<?xml version="1.0" encoding="UTF-8"?>
<Tariffs xmlns:xsi="http://www.w3.org/2001/XMLSchema-instance"
          xmlns="http://www.example.com/tariffs"
          xsi:schemaLocation="http://www.example.com/tariffs tariffs.xsd">
    <tariff name = "Business" operatorname= "Velcom">
        <payroll>69900</payroll>
        <callprices>
            <innet>500</innet>
            <outnet>100</outnet>
            <landline>50</landline>
        </callprices>
        <sms>500</sms>
        <parameters>
            <favourites>0</favourites>
            <tarification>minute</tarification>
            <payment>50000</payment>
        </parameters>
    </tariff>
    <tariff name = "BusinessPro" operatorname= "Velcom">
        <payroll>69900</payroll>
        <callprices>
            <innet>109</innet>
            <outnet>685</outnet>
            <landline>685</landline>
        </callprices>
        <sms>350</sms>
        <parameters>
            <favourites>0</favourites>
            <tarification>minute</tarification>
            <payment>10000</payment>
        </parameters>
    </tariff>
    <tariff name = "BusinessClass">
        <payroll>890000</payroll>
        <callprices>
            <innet>0</innet>
            <outnet>599</outnet>
            <landline>599</landline>
        </callprices>
        <sms>350</sms>
        <parameters>
            <favourites>0</favourites>
            <tarification>minute</tarification>
            <payment>890000</payment>
        </parameters>
    </tariff>
    <tariff name = "SummerCalls" operatorname= "Velcom">
        <payroll>30000</payroll>
        <callprices>
            <innet>425</innet>
            <outnet>1490</outnet>
            <landline>1490</landline>
        </callprices>
        <sms>350</sms>
        <parameters>
            <favourites>5</favourites>
            <tarification>minute</tarification>
            <payment>10000</payment>
        </parameters>
    </tariff>
    <tariff name = "EverybodyTalks">
        <payroll>70000</payroll>
        <callprices>
            <innet>450</innet>
            <outnet>450</outnet>
            <landline>450</landline>
        </callprices>
        <sms>350</sms>
        <parameters>
            <favourites>5</favourites>
            <tarification>minute</tarification>
            <payment>10000</payment>
        </parameters>
    </tariff>
    <tariff name = "Smart1" operatorname= "Velcom">
        <payroll>120000</payroll>
        <callprices>
            <innet>199</innet>
            <outnet>975</outnet>
            <landline>975</landline>
        </callprices>
        <sms>350</sms>
        <parameters>
            <favourites>5</favourites>
            <tarification>minute</tarification>
            <payment>10000</payment>
        </parameters>
    </tariff>
    <tariff name = "Shoes" operatorname= "Velcom">
        <payroll>85000</payroll>
        <callprices>
            <innet>425</innet>
            <outnet>1500</outnet>
            <landline>1500</landline>
        </callprices>
        <sms>350</sms>
        <parameters>
            <favourites>5</favourites>
            <tarification>second</tarification>
            <payment>10000</payment>
        </parameters>
    </tariff>
    <tariff name = "Excellent" operatorname= "MTS">
        <payroll>70000</payroll>
        <callprices>
            <innet>350</innet>
            <outnet>350</outnet>
            <landline>350</landline>
        </callprices>
        <sms>250</sms>
        <parameters>
            <favourites>0</favourites>
            <tarification>minute</tarification>
            <payment>30000</payment>
        </parameters>
    </tariff>
    <tariff name = "Talk" operatorname= "MTS">
        <payroll>40000</payroll>
        <callprices>
            <innet>400</innet>
            <outnet>850</outnet>
            <landline>850</landline>
        </callprices>
        <sms>380</sms>
        <parameters>
            <favourites>2</favourites>
            <tarification>second</tarification>
            <payment>30000</payment>
        </parameters>
    </tariff>
    <tariff name = "EasyToSay" operatorname= "MTS">
        <payroll>3000</payroll>
        <callprices>
            <innet>550</innet>
            <outnet>1000</outnet>
            <landline>1000</landline>
        </callprices>
        <sms>250</sms>
        <parameters>
            <favourites>3</favourites>
            <tarification>second</tarification>
            <payment>30000</payment>
        </parameters>
    </tariff>
    <tariff name = "Ultra" operatorname= "MTS">
        <payroll>420000</payroll>
        <callprices>
            <innet>0</innet>
            <outnet>0</outnet>
            <landline>0</landline>
        </callprices>
        <sms>260</sms>
        <parameters>
            <favourites>0</favourites>
            <tarification>second</tarification>
            <payment>420000</payment>
        </parameters>
    </tariff>
    <tariff name = "MtsSmart" operatorname= "MTS">
        <payroll>110000</payroll>
        <callprices>
            <innet>59</innet>
            <outnet>500</outnet>
            <landline>500</landline>
        </callprices>
        <sms>400</sms>
        <parameters>
            <favourites>0</favourites>
            <tarification>minute</tarification>
            <payment>30000</payment>
        </parameters>
    </tariff>
    <tariff name = "Start" operatorname= "life">
        <payroll>0</payroll>
        <callprices>
            <innet>390</innet>
            <outnet>390</outnet>
            <landline>390</landline>
        </callprices>
        <sms>300</sms>
        <parameters>
            <favourites>4</favourites>
            <tarification>minute</tarification>
            <payment>0</payment>
        </parameters>
    </tariff>
    <tariff name = "XS" operatorname= "life">
        <payroll>30000</payroll>
        <callprices>
            <innet>0</innet>
            <outnet>540</outnet>
            <landline>540</landline>
        </callprices>
        <sms>300</sms>
        <parameters>
            <favourites>0</favourites>
            <tarification>minute</tarification>
            <payment>30000</payment>
        </parameters>
    </tariff>
    <tariff name = "L" operatorname= "life">
        <payroll>100000</payroll>
        <callprices>
            <innet>0</innet>
            <outnet>0</outnet>
            <landline>0</landline>
        </callprices>
        <sms>300</sms>
        <parameters>
            <favourites>2</favourites>
            <tarification>minute</tarification>
            <payment>10000</payment>
        </parameters>
    </tariff>
</Tariffs>